Name,ID,URL,Date,Time,Venue,City,Country,Latitude,Longitude,Genre,SubGenre,PriceRange,Currency
Phoenix Suns vs. Golden State Warriors,1A_Zk7FGkdN4Nhl,https://www.ticketmaster.com/phoenix-suns-vs-golden-state-warriors-phoenix-arizona-11-30-2024/event/19006108E35636EB,2024-11-30,19:00:00,Footprint Center,Phoenix,United States Of America,33.445899,-112.071313,Basketball,NBA,139.0,USD
Phoenix Suns vs. Brooklyn Nets,1A_Zk7FGkdNfNht,https://www.ticketmaster.com/phoenix-suns-vs-brooklyn-nets-phoenix-arizona-11-27-2024/event/19006108E35236E9,2024-11-27,19:00:00,Footprint Center,Phoenix,United States Of America,33.445899,-112.071313,Basketball,NBA,33.0,USD
Golden State Warriors vs. Phoenix Suns,G5vYZb8wkueaZ,https://www.ticketmaster.com/golden-state-warriors-vs-phoenix-suns-san-francisco-california-12-28-2024/event/1C00610C86342240,2024-12-28,17:30:00,Chase Center,San Francisco,United States Of America,37.76797,-122.387464,Basketball,NBA,150.0,USD
Orlando Magic v Phoenix Suns,1AeFZb8GkDOo-zZ,https://www.ticketmaster.com/orlando-magic-v-phoenix-suns-orlando-florida-12-08-2024/event/2200610EE0461E00,2024-12-08,18:30:00,Kia Center,Orlando,United States Of America,28.539293,-81.383957,Basketball,NBA,51.0,USD
San Antonio Spurs vs Phoenix Suns,G5dIZb8kECzK3,https://www.ticketmaster.com/san-antonio-spurs-vs-phoenix-suns-austin-texas-02-20-2025/event/3A006101A73B84D2,2025-02-20,20:30:00,Moody Center ATX,Austin,United States Of America,30.280735,-97.730837,Basketball,NBA,102.0,USD
Miami Heat vs. Phoenix Suns,vvG1VZb8Do8067,https://www.ticketmaster.com/miami-heat-vs-phoenix-suns-miami-florida-12-07-2024/event/0D00610ED14241C4,2024-12-07,20:00:00,Kaseya Center,Miami,United States Of America,25.781232,-80.187805,Basketball,NBA,40.0,USD
Phoenix Suns vs. San Antonio (NBA Cup Group Play),1A_Zk7FGkdNpNhR,https://www.ticketmaster.com/phoenix-suns-vs-san-antonio-nba-phoenix-arizona-12-03-2024/event/19006108E35A36EF,2024-12-03,19:00:00,Footprint Center,Phoenix,United States Of America,33.445899,-112.071313,Basketball,NBA,49.0,USD
Phoenix Suns vs. Memphis Grizzlies,1A_Zk7FGkdNrSjc,https://www.ticketmaster.com/phoenix-suns-vs-memphis-grizzlies-phoenix-arizona-12-31-2024/event/19006108E37B372D,2024-12-31,19:00:00,Footprint Center,Phoenix,United States Of America,33.445899,-112.071313,Basketball,NBA,44.0,USD
Phoenix Suns vs. Indiana Pacers,1A_Zk7FGkdN_ShH,https://www.ticketmaster.com/phoenix-suns-vs-indiana-pacers-phoenix-arizona-12-19-2024/event/19006108E36736FC,2024-12-19,19:00:00,Footprint Center,Phoenix,United States Of America,33.445899,-112.071313,Basketball,NBA,37.0,USD
Indiana Pacers vs. Phoenix Suns,vv17fZb8GkDOTdiy,https://www.ticketmaster.com/indiana-pacers-vs-phoenix-suns-indianapolis-indiana-01-04-2025/event/0500610EE0FC3B39,2025-01-04,19:00:00,Gainbridge Fieldhouse,Indianapolis,United States Of America,39.764064,-86.155507,Basketball,NBA,52.0,USD
Golden State Warriors vs. Phoenix Suns,G5vYZb8wARwAV,https://www.ticketmaster.com/golden-state-warriors-vs-phoenix-suns-san-francisco-california-01-31-2025/event/1C00610C85BF2174,2025-01-31,19:00:00,Chase Center,San Francisco,United States Of America,37.76797,-122.387464,Basketball,NBA,135.0,USD
Phoenix Suns vs. Utah Jazz,1A_Zk7FGkdxsKbU,https://www.ticketmaster.com/phoenix-suns-vs-utah-jazz-phoenix-arizona-01-11-2025/event/19006108E2C53636,2025-01-11,15:00:00,Footprint Center,Phoenix,United States Of America,33.445899,-112.071313,Basketball,NBA,57.0,USD
Brooklyn Nets v. Phoenix Suns,1AdZZb8GkUEExdZ,https://www.ticketmaster.com/brooklyn-nets-v-phoenix-suns-brooklyn-new-york-01-22-2025/event/3000610DA79E20C0,2025-01-22,19:30:00,Barclays Center,Brooklyn,United States Of America,40.68285,-73.97519,Basketball,NBA,48.0,USD
Charlotte Hornets vs. Phoenix Suns,G5eVZbCHkG_27,https://www.ticketmaster.com/charlotte-hornets-vs-phoenix-suns-charlotte-north-carolina-01-07-2025/event/2D0060EF063193C4,2025-01-07,19:00:00,Spectrum Center ,Charlotte,United States Of America,35.225222,-80.839921,Basketball,NBA,18.5,USD
Atlanta Hawks vs Phoenix Suns,vvG1zZb8h0ZA7X,https://www.ticketmaster.com/atlanta-hawks-vs-phoenix-suns-atlanta-georgia-01-14-2025/event/0E006106E400513E,2025-01-14,19:30:00,State Farm Arena,Atlanta,United States Of America,33.757796,-84.394569,Basketball,NBA,38.0,USD
Porland Trail Blazers v Phoenix Suns - Black History Night,vvG1HZbClafVJQ,https://www.ticketmaster.com/porland-trail-blazers-v-phoenix-suns-portland-oregon-02-01-2025/event/0F0060EAC953499A,2025-02-01,19:00:00,Moda Center,Portland,United States Of America,45.53118896,-122.66645813,Basketball,NBA,25.0,USD
Phoenix Suns vs. Minnesota Timberwolves,1A_Zk7FGkdxgN_f,https://www.ticketmaster.com/phoenix-suns-vs-minnesota-timberwolves-phoenix-arizona-01-29-2025/event/19006108E2D63654,2025-01-29,19:00:00,Footprint Center,Phoenix,United States Of America,33.445899,-112.071313,Basketball,NBA,37.0,USD
Phoenix Suns vs. Atlanta Hawks,1A_Zk7FGkdxRNbw,https://www.ticketmaster.com/phoenix-suns-vs-atlanta-hawks-phoenix-arizona-01-09-2025/event/19006108E2BE3632,2025-01-09,19:00:00,Footprint Center,Phoenix,United States Of America,33.445899,-112.071313,Basketball,NBA,46.0,USD
Phoenix Suns vs. Golden State Warriors,1A_Zk7FGkdNASQV,https://www.ticketmaster.com/phoenix-suns-vs-golden-state-warriors-phoenix-arizona-04-08-2025/event/19006108E31736B4,2025-04-08,19:00:00,Footprint Center,Phoenix,United States Of America,33.445899,-112.071313,Basketball,NBA,123.0,USD
SACRAMENTO KINGS VS. PHOENIX SUNS,G5vYZb2n_2V2d,https://www.ticketmaster.com/sacramento-kings-vs-phoenix-suns-sacramento-california-04-13-2025/event/1C0060FA993F43C3,2025-04-13,12:30:00,Golden 1 Center,Sacramento,United States Of America,38.580372,-121.500231,Basketball,NBA,40.0,USD
Phoenix Suns vs. Charlotte Hornets,1A_Zk7FGkdxwK_Z,https://www.ticketmaster.com/phoenix-suns-vs-charlotte-hornets-phoenix-arizona-01-12-2025/event/19006108E2C93640,2025-01-12,19:00:00,Footprint Center,Phoenix,United States Of America,33.445899,-112.071313,Basketball,NBA,49.0,USD
Phoenix Suns vs. Milwaukee Bucks,1A_Zk7FGkdNeNQl,https://www.ticketmaster.com/phoenix-suns-vs-milwaukee-bucks-phoenix-arizona-03-24-2025/event/19006108E30A36AB,2025-03-24,19:00:00,Footprint Center,Phoenix,United States Of America,33.445899,-112.071313,Basketball,NBA,77.0,USD
Phoenix Suns vs. Minnesota Timberwolves,1A_Zk7FGkdxHd_T,https://www.ticketmaster.com/phoenix-suns-vs-minnesota-timberwolves-phoenix-arizona-03-02-2025/event/19006108E2F0367F,2025-03-02,19:30:00,Footprint Center,Phoenix,United States Of America,33.445899,-112.071313,Basketball,NBA,77.0,USD
Portland Trail Blazers vs. Phoenix Suns,vvG1HZbClap7Jq,https://www.ticketmaster.com/portland-trail-blazers-vs-phoenix-suns-portland-oregon-02-03-2025/event/0F0060EAC958499D,2025-02-03,19:00:00,Moda Center,Portland,United States Of America,45.53118896,-122.66645813,Basketball,NBA,18.0,USD
Oklahoma City Thunder vs. Phoenix Suns,vvG1YZb8D7yShm,https://www.ticketmaster.com/oklahoma-city-thunder-vs-phoenix-suns-oklahoma-city-oklahoma-02-05-2025/event/0C00610EC4E736EE,2025-02-05,19:00:00,Paycom Center,Oklahoma City,United States Of America,35.463391,-97.514594,Basketball,NBA,12.0,USD
Phoenix Suns vs. Utah Jazz,1A_Zk7FGkdxUN_l,https://www.ticketmaster.com/phoenix-suns-vs-utah-jazz-phoenix-arizona-02-07-2025/event/19006108E2DA366B,2025-02-07,20:00:00,Footprint Center,Phoenix,United States Of America,33.445899,-112.071313,Basketball,NBA,77.0,USD
Memphis Grizzlies vs. Phoenix Suns,G5viZb8wypxqY,https://www.ticketmaster.com/memphis-grizzlies-vs-phoenix-suns-memphis-tennessee-02-25-2025/event/1B00610CB95A2770,2025-02-25,19:00:00,FedExForum,Memphis,United States Of America,35.1394709,-90.0514933,Basketball,NBA,35.0,USD
Phoenix Suns vs. Memphis Grizzlies,1A_Zk7FGkdxzS_U,https://www.ticketmaster.com/phoenix-suns-vs-memphis-grizzlies-phoenix-arizona-02-11-2025/event/19006108E2E33676,2025-02-11,20:00:00,Footprint Center,Phoenix,United States Of America,33.445899,-112.071313,Basketball,NBA,54.0,USD
Phoenix Suns vs. San Antonio Spurs,1A_Zk7FGkdNFdQD,https://www.ticketmaster.com/phoenix-suns-vs-san-antonio-spurs-phoenix-arizona-04-11-2025/event/19006108E32036BB,2025-04-11,19:00:00,Footprint Center,Phoenix,United States Of America,33.445899,-112.071313,Basketball,NBA,77.0,USD
Memphis Grizzlies vs. Phoenix Suns,G5viZb8wM2wCs,https://www.ticketmaster.com/memphis-grizzlies-vs-phoenix-suns-memphis-tennessee-03-10-2025/event/1B00610CB73F23B1,2025-03-10,19:00:00,FedExForum,Memphis,United States Of America,35.1394709,-90.0514933,Basketball,NBA,35.0,USD
Phoenix Suns vs. New Orleans Pelicans,1A_Zk7FGkdxyS_z,https://www.ticketmaster.com/phoenix-suns-vs-new-orleans-pelicans-phoenix-arizona-02-27-2025/event/19006108E2E73678,2025-02-27,20:00:00,Footprint Center,Phoenix,United States Of America,33.445899,-112.071313,Basketball,NBA,53.0,USD
Milwaukee Bucks vs. Phoenix Suns,vv1kjZb8ffG7XS3c,https://www.ticketmaster.com/milwaukee-bucks-vs-phoenix-suns-milwaukee-wisconsin-04-01-2025/event/0700610514FB34AD,2025-04-01,19:00:00,Fiserv Forum,Milwaukee,United States Of America,43.04228,-87.916896,Basketball,NBA,21.0,USD
Phoenix Suns vs. Sacramento Kings,1A_Zk7FGkdxXKQ9,https://www.ticketmaster.com/phoenix-suns-vs-sacramento-kings-phoenix-arizona-03-14-2025/event/19006108E2F93697,2025-03-14,19:00:00,Footprint Center,Phoenix,United States Of America,33.445899,-112.071313,Basketball,NBA,77.0,USD
Phoenix Suns vs. Oklahoma City Thunder,1A_Zk7FGkdN6dQz,https://www.ticketmaster.com/phoenix-suns-vs-oklahoma-city-thunder-phoenix-arizona-04-09-2025/event/19006108E31C36B8,2025-04-09,19:00:00,Footprint Center,Phoenix,United States Of America,33.445899,-112.071313,Basketball,NBA,77.0,USD
Phoenix Suns vs. New Orleans Pelicans,1A_Zk7FGkdxDd_D,https://www.ticketmaster.com/phoenix-suns-vs-new-orleans-pelicans-phoenix-arizona-02-28-2025/event/19006108E2EC367B,2025-02-28,19:00:00,Footprint Center,Phoenix,United States Of America,33.445899,-112.071313,Basketball,NBA,89.0,USD
New Orleans Pelicans vs. Phoenix Suns,Z7r9jZ1A7C3xp,https://www.ticketmaster.com/event/Z7r9jZ1A7C3xp,2024-12-05,19:00:00,Smoothie King Center,New Orleans,United States Of America,29.9429,-90.082802,Basketball,NBA,,
Minnesota Timberwolves vs. Phoenix Suns,Z7r9jZ1A7C3jA,https://www.ticketmaster.com/event/Z7r9jZ1A7C3jA,2025-03-28,19:00:00,Target Center,Minneapolis,United States Of America,44.970299,-93.286102,Basketball,NBA,,
2025 Navy Federal Credit Union NHL Stadium Series - DET v. CBJ,vvG1fZb265h4W8,https://www.ticketmaster.com/2025-navy-federal-credit-union-nhl-columbus-ohio-03-01-2025/event/050060F1CB6D5F50,2025-03-01,18:00:00,Ohio Stadium,Columbus,United States Of America,40.004003,-83.019363,Hockey,NHL,40.0,USD
Kansas City Chiefs v Las Vegas Raiders,vv17bZbkGkD7C7jA,https://www.ticketmaster.com/kansas-city-chiefs-v-las-vegas-kansas-city-missouri-11-29-2024/event/0600606EC4384705,2024-11-29,14:00:00,GEHA Field at Arrowhead Stadium,Kansas City,United States Of America,39.04921048,-94.48417065,Football,NFL,190.0,USD
Green Bay Packers vs. Miami Dolphins,vv1A6ZkevGkdd2dCL,https://www.ticketmaster.com/green-bay-packers-vs-miami-dolphins-green-bay-wisconsin-11-28-2024/event/07006081C33C339F,2024-11-28,19:20:00,Lambeau Field,Green Bay,United States Of America,44.5012386,-88.0622376,Football,NFL,95.0,USD
Detroit Lions vs. Chicago Bears,vv1AFZkeoGkd7oxii,https://www.ticketmaster.com/detroit-lions-vs-chicago-bears-detroit-michigan-11-28-2024/event/08006091C4462B2C,2024-11-28,12:30:00,Ford Field,Detroit,United States Of America,42.339924,-83.045543,Football,NFL,999.0,USD
Buffalo Bills vs. San Francisco 49ers,k7vGFbkBGzvJp,https://www.ticketmaster.com/buffalo-bills-vs-san-francisco-49ers-orchard-park-new-york-12-01-2024/event/0000606E8CE01996,2024-12-01,20:20:00,Highmark Stadium,Orchard Park,United States Of America,42.773743,-78.786955,Football,NFL,128.74,USD
Discover NHL Winter Classic- St. Louis Blues v Chicago Blackhawks,vvG18Zb5epIszq,https://www.ticketmaster.com/discover-nhl-winter-classic-st-louis-chicago-illinois-12-31-2024/event/040060B096A31E1D,2024-12-31,16:00:00,Wrigley Field,Chicago,United States Of America,41.947304,-87.656447,Hockey,NHL,125.0,USD
Dallas Cowboys vs. New York Giants,vvG1YZbFnf2oNf,https://www.ticketmaster.com/dallas-cowboys-vs-new-york-giants-arlington-texas-11-28-2024/event/0C00608A943D18D4,2024-11-28,15:30:00,AT&T Stadium,Arlington,United States Of America,32.74790427,-97.09345578,Football,NFL,,
Pittsburgh Steelers vs. Kansas City Chiefs,1ApZkvPGkey1N84,https://www.ticketmaster.com/pittsburgh-steelers-vs-kansas-city-chiefs-pittsburgh-pennsylvania-12-25-2024/event/16006065B92A3415,2024-12-25,13:00:00,Acrisure Stadium,Pittsburgh,United States Of America,40.446093,-80.015884,Football,NFL,50.0,USD
Minnesota Vikings vs. Arizona Cardinals,vv17bZb7GkMuikir,https://www.ticketmaster.com/minnesota-vikings-vs-arizona-cardinals-minneapolis-minnesota-12-01-2024/event/0600604DCDB06B1E,2024-12-01,12:00:00,U.S. Bank Stadium,Minneapolis,United States Of America,44.973617,-93.257528,Football,NFL,76.0,USD
Minnesota Vikings vs. Atlanta Falcons,vv17bZb7GkM2gURT,https://www.ticketmaster.com/minnesota-vikings-vs-atlanta-falcons-minneapolis-minnesota-12-08-2024/event/0600604DCFD76BFF,2024-12-08,12:00:00,U.S. Bank Stadium,Minneapolis,United States Of America,44.973617,-93.257528,Football,NFL,84.0,USD
Seattle Seahawks v Green Bay Packers,vvG1HZbFH8Ip0J,https://www.ticketmaster.com/seattle-seahawks-v-green-bay-packers-seattle-washington-12-15-2024/event/0F00608F10A16926,2024-12-15,17:20:00,Lumen Field,Seattle,United States Of America,47.595083,-122.331607,Football,NFL,150.0,USD
Minnesota Vikings vs. Green Bay Packers,vv17bZb7GkM5-Un1,https://www.ticketmaster.com/minnesota-vikings-vs-green-bay-packers-minneapolis-minnesota-12-29-2024/event/0600604DCB876A8A,2024-12-29,12:00:00,U.S. Bank Stadium,Minneapolis,United States Of America,44.973617,-93.257528,Football,NFL,150.0,USD
Eagles Live at Sphere,17AYvOG6GbfH7QD,https://www.ticketmaster.com/eagles-live-at-sphere-las-vegas-nevada-01-18-2025/event/170060C614F046BB,2025-01-18,20:30:00,Sphere,Las Vegas,United States Of America,36.1207267,-115.1642896,Rock,Pop,127.5,USD
Carolina Panthers vs. Tampa Bay Buccaneers,G5eVZbkD5cJdA,https://www.ticketmaster.com/carolina-panthers-vs-tampa-bay-buccaneers-charlotte-north-carolina-12-01-2024/event/2D00606ECBB660C5,2024-12-01,16:05:00,Bank of America Stadium,Charlotte,United States Of America,35.225789,-80.852829,Football,NFL,53.0,USD
Philadelphia Eagles vs. Pittsburgh Steelers,vv17FZbaGkM3wf-2,https://www.ticketmaster.com/philadelphia-eagles-vs-pittsburgh-steelers-philadelphia-pennsylvania-12-15-2024/event/0200609DD2C9484F,2024-12-15,16:25:00,Lincoln Financial Field,Philadelphia,United States Of America,39.900706,-75.167406,Football,NFL,130.0,USD
Pittsburgh Steelers vs. Cleveland Browns,1ApZkvPGkeyFK2L,https://www.ticketmaster.com/pittsburgh-steelers-vs-cleveland-browns-pittsburgh-pennsylvania-12-08-2024/event/16006065B92133DF,2024-12-08,13:00:00,Acrisure Stadium,Pittsburgh,United States Of America,40.446093,-80.015884,Football,NFL,50.0,USD
New York Jets vs. Seattle Seahawks,k7vGFb6M6-pq_,https://www.ticketmaster.com/new-york-jets-vs-seattle-seahawks-east-rutherford-new-jersey-12-01-2024/event/0000607DC7856759,2024-12-01,13:00:00,MetLife Stadium,East Rutherford,United States Of America,40.81359,-74.074493,Football,NFL,74.0,USD
Atlanta Falcons vs. Los Angeles Chargers,vvG1zZbFRLSE7-,https://www.ticketmaster.com/atlanta-falcons-vs-los-angeles-chargers-atlanta-georgia-12-01-2024/event/0E00608BDFCE7121,2024-12-01,13:00:00,Mercedes-Benz Stadium,Atlanta,United States Of America,33.755389,-84.400823,Football,NFL,55.0,USD
Cincinnati Bengals vs. Pittsburgh Steelers,1AvbZb6GklZS7q3,https://www.ticketmaster.com/cincinnati-bengals-vs-pittsburgh-steelers-cincinnati-ohio-12-01-2024/event/1600607AC0CC4752,2024-12-01,13:00:00,Paycor Stadium,Cincinnati,United States Of America,39.0955556,-84.5161111,Football,NFL,125.0,USD
Eagles Live at Sphere,17AYvOG6GbfgVQK,https://www.ticketmaster.com/eagles-live-at-sphere-las-vegas-nevada-12-06-2024/event/170060C614D74693,2024-12-06,20:30:00,Sphere,Las Vegas,United States Of America,36.1207267,-115.1642896,Rock,Pop,127.5,USD
San Francisco 49ers vs. Chicago Bears,G5vYZbFm7U3Bk,https://www.ticketmaster.com/san-francisco-49ers-vs-chicago-bears-santa-clara-california-12-08-2024/event/1C00608B84D92E86,2024-12-08,13:25:00,Levi's® Stadium,Santa Clara,United States Of America,37.40367671,-121.97034311,Football,NFL,130.0,USD
Philadelphia Eagles vs. Dallas Cowboys,vv17FZbaGkM3c7OE,https://www.ticketmaster.com/philadelphia-eagles-vs-dallas-cowboys-philadelphia-pennsylvania-12-29-2024/event/0200609DD2B44827,2024-12-29,16:25:00,Lincoln Financial Field,Philadelphia,United States Of America,39.900706,-75.167406,Football,NFL,130.0,USD
Eagles Live at Sphere,17AYvOG6Gbfz7QJ,https://www.ticketmaster.com/eagles-live-at-sphere-las-vegas-nevada-12-13-2024/event/170060C614E046A6,2024-12-13,20:30:00,Sphere,Las Vegas,United States Of America,36.1207267,-115.1642896,Rock,Pop,127.5,USD
Eagles Live at Sphere,17AYvOG6GbfUfQp,https://www.ticketmaster.com/eagles-live-at-sphere-las-vegas-nevada-12-07-2024/event/170060C614D94696,2024-12-07,20:30:00,Sphere,Las Vegas,United States Of America,36.1207267,-115.1642896,Rock,Pop,127.5,USD
Buffalo Bills vs. New York Jets,k7vGFbkBuvvEu,https://www.ticketmaster.com/buffalo-bills-vs-new-york-jets-orchard-park-new-york-12-29-2024/event/0000606E8D0419CD,2024-12-29,13:00:00,Highmark Stadium,Orchard Park,United States Of America,42.773743,-78.786955,Football,NFL,147.13,USD
Eagles Live at Sphere,17AYvOG6GbfzVQt,https://www.ticketmaster.com/eagles-live-at-sphere-las-vegas-nevada-12-14-2024/event/170060C614E346A9,2024-12-14,20:30:00,Sphere,Las Vegas,United States Of America,36.1207267,-115.1642896,Rock,Pop,127.5,USD
Minnesota Vikings vs. Chicago Bears,vv17bZb7GkMGKknH,https://www.ticketmaster.com/minnesota-vikings-vs-chicago-bears-minneapolis-minnesota-12-16-2024/event/0600604DCC4C6ABC,2024-12-16,19:00:00,U.S. Bank Stadium,Minneapolis,United States Of America,44.973617,-93.257528,Football,NFL,84.0,USD
Houston Texans vs. Baltimore Ravens,G5dIZbaugYsmZ,https://www.ticketmaster.com/houston-texans-vs-baltimore-ravens-houston-texas-12-25-2024/event/3A00609375C31B80,2024-12-25,15:30:00,NRG Stadium,Houston,United States Of America,29.684885,-95.410875,Football,NFL,275.0,USD
Philadelphia Eagles vs. Carolina Panthers,vv17FZbaGkM3nfO-,https://www.ticketmaster.com/philadelphia-eagles-vs-carolina-panthers-philadelphia-pennsylvania-12-08-2024/event/0200609DD2A94821,2024-12-08,13:00:00,Lincoln Financial Field,Philadelphia,United States Of America,39.900706,-75.167406,Football,NFL,95.0,USD
Eagles Live at Sphere,17AYvOG6GbfD0Qz,https://www.ticketmaster.com/eagles-live-at-sphere-las-vegas-nevada-01-17-2025/event/170060C614EE46B8,2025-01-17,20:30:00,Sphere,Las Vegas,United States Of America,36.1207267,-115.1642896,Rock,Pop,127.5,USD
Carolina Panthers vs. Dallas Cowboys,G5eVZbkD69ggv,https://www.ticketmaster.com/carolina-panthers-vs-dallas-cowboys-charlotte-north-carolina-12-15-2024/event/2D00606EC75F5D41,2024-12-15,13:00:00,Bank of America Stadium,Charlotte,United States Of America,35.225789,-80.852829,Football,NFL,120.0,USD
Eagles Live at Sphere,17AYvOG6GbfXfhA,https://www.ticketmaster.com/eagles-live-at-sphere-las-vegas-nevada-01-25-2025/event/170060C614F946C5,2025-01-25,20:30:00,Sphere,Las Vegas,United States Of America,36.1207267,-115.1642896,Rock,Pop,127.5,USD
Los Angeles Chargers vs. Denver Broncos,vvG1IZb6CbHsxy,https://www.ticketmaster.com/los-angeles-chargers-vs-denver-broncos-inglewood-california-12-19-2024/event/0A00607398F318B9,2024-12-19,17:15:00,SoFi Stadium,Inglewood,United States Of America,33.950529,-118.343767,Football,NFL,80.0,USD
Seattle Seahawks v Minnesota Vikings,vvG1HZbFH8sU0m,https://www.ticketmaster.com/seattle-seahawks-v-minnesota-vikings-seattle-washington-12-22-2024/event/0F00608F10C7692E,2024-12-22,13:05:00,Lumen Field,Seattle,United States Of America,47.595083,-122.331607,Football,NFL,95.0,USD
Eagles Live at Sphere,17AYvOG6GbfWVhv,https://www.ticketmaster.com/eagles-live-at-sphere-las-vegas-nevada-01-24-2025/event/170060C614F746C1,2025-01-24,20:30:00,Sphere,Las Vegas,United States Of America,36.1207267,-115.1642896,Rock,Pop,127.5,USD
Denver Broncos vs. Cleveland Browns,G5vzZbk3--sjY,https://www.ticketmaster.com/denver-broncos-vs-cleveland-browns-denver-colorado-12-02-2024/event/1E006064A1871730,2024-12-02,18:15:00,Empower Field At Mile High,Denver,United States Of America,39.743853,-105.020127,Football,NFL,73.0,USD
Kansas City Chiefs v Houston Texans,vv17bZbkGkD710hr,https://www.ticketmaster.com/kansas-city-chiefs-v-houston-texans-kansas-city-missouri-12-21-2024/event/0600606EC42A46DE,2024-12-21,12:00:00,GEHA Field at Arrowhead Stadium,Kansas City,United States Of America,39.04921048,-94.48417065,Football,NFL,260.0,USD
Las Vegas Raiders vs. Atlanta Falcons,1AvjZbFGkX-oZXN,https://www.ticketmaster.com/las-vegas-raiders-vs-atlanta-falcons-las-vegas-nevada-12-16-2024/event/1700608FA1440FA3,2024-12-16,17:30:00,Allegiant Stadium,Las Vegas,United States Of America,36.0909,-115.1833,Football,NFL,197.0,USD
Green Bay Packers vs. New Orleans Saints,vv1A6ZkevGkdd8NCx,https://www.ticketmaster.com/green-bay-packers-vs-new-orleans-green-bay-wisconsin-12-23-2024/event/07006081C34233A2,2024-12-23,19:15:00,Lambeau Field,Green Bay,United States Of America,44.5012386,-88.0622376,Football,NFL,95.0,USD
Eagles Live at Sphere,1a9Zk7Y3ppAZe5a,https://www.ticketmaster.com/eagles-live-at-sphere-las-vegas-nevada-02-14-2025/event/17006130496585A8,2025-02-14,20:30:00,Sphere,Las Vegas,United States Of America,36.1207267,-115.1642896,Rock,Pop,127.5,USD
Eagles Live at Sphere,169Zk7Y3pZA5akGF,https://www.ticketmaster.com/eagles-live-at-sphere-las-vegas-nevada-02-15-2025/event/17006130496A85B7,2025-02-15,20:30:00,Sphere,Las Vegas,United States Of America,36.1207267,-115.1642896,Rock,Pop,127.5,USD
Kansas City Chiefs v Los Angeles Chargers,vv17bZbkGkD7G0hP,https://www.ticketmaster.com/kansas-city-chiefs-v-los-angeles-kansas-city-missouri-12-08-2024/event/0600606EC43246E5,2024-12-08,19:20:00,GEHA Field at Arrowhead Stadium,Kansas City,United States Of America,39.04921048,-94.48417065,Football,NFL,205.0,USD
Eagles Live at Sphere,1a9Zk7Y34xAZe56,https://www.ticketmaster.com/eagles-live-at-sphere-las-vegas-nevada-02-22-2025/event/17006130495885A6,2025-02-22,20:30:00,Sphere,Las Vegas,United States Of America,36.1207267,-115.1642896,Rock,Pop,127.5,USD
Eagles Live at Sphere,169Zk7Y33ZAuak57,https://www.ticketmaster.com/eagles-live-at-sphere-las-vegas-nevada-02-21-2025/event/17006130492C85A3,2025-02-21,20:30:00,Sphere,Las Vegas,United States Of America,36.1207267,-115.1642896,Rock,Pop,127.5,USD
San Antonio Spurs vs. Los Angeles Lakers,G5dIZb8wjTw8Z,https://www.ticketmaster.com/san-antonio-spurs-vs-los-angeles-san-antonio-texas-11-27-2024/event/3A00610C9CFF2400,2024-11-27,19:30:00,Frost Bank Center,San Antonio,United States Of America,29.4330386,-98.4337987,Basketball,NBA,75.0,USD
Eagles Live at Sphere,169Zk7Y39ZA2aku6,https://www.ticketmaster.com/eagles-live-at-sphere-las-vegas-nevada-03-15-2025/event/17006130497E85C6,2025-03-15,20:30:00,Sphere,Las Vegas,United States Of America,36.1207267,-115.1642896,Rock,Pop,127.5,USD
Eagles Live at Sphere,1a9Zk7Y39JAZeuA,https://www.ticketmaster.com/eagles-live-at-sphere-las-vegas-nevada-03-14-2025/event/17006130497985C4,2025-03-14,20:30:00,Sphere,Las Vegas,United States Of America,36.1207267,-115.1642896,Rock,Pop,127.5,USD
Eagles Live at Sphere,1a9Zk7Y39CAZeud,https://www.ticketmaster.com/eagles-live-at-sphere-las-vegas-nevada-03-08-2025/event/17006130497385C2,2025-03-08,20:30:00,Sphere,Las Vegas,United States Of America,36.1207267,-115.1642896,Rock,Pop,127.5,USD
Eagles Live at Sphere,169Zk7Y3pZA8akG5,https://www.ticketmaster.com/eagles-live-at-sphere-las-vegas-nevada-03-07-2025/event/17006130496F85BA,2025-03-07,20:30:00,Sphere,Las Vegas,United States Of America,36.1207267,-115.1642896,Rock,Pop,127.5,USD
Tampa Bay Buccaneers vs. Las Vegas Raiders,vvG1VZb69xQSSG,https://www.ticketmaster.com/tampa-bay-buccaneers-vs-las-vegas-tampa-florida-12-08-2024/event/0D006075E26B3CCC,2024-12-08,13:00:00,Raymond James Stadium,Tampa,United States Of America,27.975976,-82.503474,Football,NFL,103.0,USD
Los Angeles Chargers vs. Tampa Bay Buccaneers,vvG1IZb6CbS-xj,https://www.ticketmaster.com/los-angeles-chargers-vs-tampa-bay-inglewood-california-12-15-2024/event/0A00607398CE189C,2024-12-15,13:25:00,SoFi Stadium,Inglewood,United States Of America,33.950529,-118.343767,Football,NFL,64.0,USD
Atlanta Falcons vs. New York Giants,vvG1zZbFRLU67J,https://www.ticketmaster.com/atlanta-falcons-vs-new-york-giants-atlanta-georgia-12-22-2024/event/0E00608BDFD87126,2024-12-22,13:00:00,Mercedes-Benz Stadium,Atlanta,United States Of America,33.755389,-84.400823,Football,NFL,80.0,USD
Cleveland Browns vs. Kansas City Chiefs,vv1AAZke8GkdIbgRf,https://www.ticketmaster.com/cleveland-browns-vs-kansas-city-chiefs-cleveland-ohio-12-15-2024/event/05006090E8635BD4,2024-12-15,13:00:00,Huntington Bank Field,Cleveland,United States Of America,41.50603554,-81.69956958,Football,NFL,98.0,USD
CBS Sports Classic,G5diZbC1r2ZwV,https://www.ticketmaster.com/cbs-sports-classic-new-york-new-york-12-21-2024/event/3B0060E29E3C0CB4,2024-12-21,15:00:00,Madison Square Garden,New York,United States Of America,40.7497062,-73.9916006,Basketball,College,97.0,USD
New York Giants vs. Baltimore Ravens,k7vGFbahj7VUJ,https://www.ticketmaster.com/new-york-giants-vs-baltimore-ravens-east-rutherford-new-jersey-12-15-2024/event/00006096DC134DA6,2024-12-15,13:00:00,MetLife Stadium,East Rutherford,United States Of America,40.81359,-74.074493,Football,NFL,95.0,USD
